<?xml version="1.0" encoding="UTF-8"?>
<!DOCTYPE export PUBLIC "JGloss export/1.0/JGloss export template description/EN"
                        "http://jgloss.sourceforge.net/export-descriptor.dtd">

<!--

 Copyright (C) 2003 Michael Koch (tensberg@gmx.net)

 This file is part of JGloss.

 JGloss is free software; you can redistribute it and/or modify
 it under the terms of the GNU General Public License as published by
 the Free Software Foundation; either version 2 of the License, or
 (at your option) any later version.

 JGloss is distributed in the hope that it will be useful,
 but WITHOUT ANY WARRANTY; without even the implied warranty of
 MERCHANTABILITY or FITNESS FOR A PARTICULAR PURPOSE.  See the
 GNU General Public License for more details.

 You should have received a copy of the GNU General Public License
 along with JGloss; if not, write to the Free Software
 Foundation, Inc., 59 Temple Place, Suite 330, Boston, MA  02111-1307  USA

 $Id$

-->

<export>
  <description>
    <menuitem key="export.annotationlist.menu" />
    <title key="export.annotationlist.title" />
  </description>

  <parameters>
    
    <encoding name="encoding"
      label-key="export.encodings" 
      prefs-key="export.annotationlist.encoding" 
      >UTF-8</encoding>
    
    <docname name="document-filename" />
    <datetime name="generation-time" />
 
  </parameters>
  
  <template>
    <source>annotationlist.xslt</source>
  </template>
</export>
