<?xml version="1.0" encoding="UTF-8"?>
<!DOCTYPE export PUBLIC "JGloss export/1.0/JGloss export template description/EN"
                        "http://jgloss.sourceforge.net/export-descriptor.dtd">

<!--

 Copyright (C) 2002-2004 Michael Koch (tensberg@gmx.net)

 This file is part of JGloss.

 JGloss is free software; you can redistribute it and/or modify
 it under the terms of the GNU General Public License as published by
 the Free Software Foundation; either version 2 of the License, or
 (at your option) any later version.

 JGloss is distributed in the hope that it will be useful,
 but WITHOUT ANY WARRANTY; without even the implied warranty of
 MERCHANTABILITY or FITNESS FOR A PARTICULAR PURPOSE.  See the
 GNU General Public License for more details.

 You should have received a copy of the GNU General Public License
 along with JGloss; if not, write to the Free Software
 Foundation, Inc., 59 Temple Place, Suite 330, Boston, MA  02111-1307  USA

 $Id$

-->

<export>
  <description>
    <menuitem key="export.latex.menu" />
    <title key="export.latex.title" />
    <file-extension description-key="filefilter.description.latex">tex</file-extension>
  </description>

  <export-class>jgloss.ui.export.LaTeXExporter</export-class>

  <parameters>
    <docname name="document-filename" />
    <datetime name="generation-time" />
    <longest-annotation name="longest-word" type="dictionary-word" />
    <longest-annotation name="longest-reading" type="dictionary-reading" />

    <list name="font-size"
      label-key="export.latex.fontsize"
      prefs-key="export.latex.fontsize">
      <listitem><value>10</value></listitem>
      <listitem><value>11</value></listitem>
      <listitem><value>12</value></listitem>
    </list>

  </parameters>
  
  <templates label-key="export.templates" prefs-key="export.latex.templates">
    <template>
      <label-key>export.latex.template.platex-top</label-key>
      <source>platex-top.tex.xslt</source>
    </template>
    <template>
      <label-key>export.latex.template.platex-list</label-key>
      <source>platex-list.tex.xslt</source>
    </template>
    <template>
      <label-key>export.latex.template.platex-ruby</label-key>
      <source>platex-ruby.tex.xslt</source>
    </template>
    <template>
      <label-key>export.latex.template.latexcjk-top</label-key>
      <source>latexcjk-top.tex.xslt</source>
    </template>
    <template>
      <label-key>export.latex.template.latexcjk-list</label-key>
      <source>latexcjk-list.tex.xslt</source>
    </template>
    <template>
      <label-key>export.latex.template.latexcjk-ruby</label-key>
      <source>latexcjk-ruby.tex.xslt</source>
    </template>
  </templates>
</export>
